Yahoo! Finance,"stock quotes, investments, loans, insurance, and more. ",Category:,Finance and Investment,finance.yahoo.com/ -,32k -,Cached -,More pages from this site
Motley Fool ,financial forum for the individual investor. ,Category:,Finance and Investment, www.fool.com/ -,35k -,Cached,
International Finance Corporation (IFC) Open this result in new window,world's largest multilateral source of finance for private sector projects in developing countries. ,Category:,Global Development > Organisations, www.ifc.org/ -,23k -,Cached -,More pages from this site
Kiplinger,"puts financial events in perspective on a daily basis. Stock quotes, mutual fund rankings, financial frequently-asked-questions and interactive resources are available. ",Category:," U.S. States > Washington, D.C. > Investment Services", www.kiplinger.com/ -,44k -,Cached,
FinanCenter,"interactive calculators and forms for investment securities, mortgages, auto loans, depreciation, savings growth, and more. ",Category:, Finance Reference > Calculators, www.financenter.com/ - ,17k -,Cached,
FinanceNet ,the Internet home for public financial management worldwide; operated by the National Science Foundation under the sponsorship of U.S. Chief Financial Officers Council. ,Category:,U.S. Government > FinanceNet, www.financenet.gov/ -,6k - ,Cached,
Quicken.com ,"covering stocks, mutual funds, insurance, taxes, and financing. ",Category:,Finance and Investment,www.quicken.com/ -,37k -,Cached,
Ministry of Finance,,Category:,Japan > Ministry of Finance, www.mof.go.jp/ -,36k -,Cached -,More pages from this site
Finance ,,Category:, U.S. Senate > Committees, finance.senate.gov/ -,17k -,Cached -,More pages from this site
Department of Finance,,Category:, Canada > Federal Government > Finance, www.fin.gc.ca/ - ,4k -,Cached -,More pages from this site
Boursorama - Votre partenaire pour investir - Bourse et ... Open this result in new window,"Votre partenaire pour investir, Flux. dimanche 1 fevrier - 06:41. Client | Membre : Mot de passe : …",,, www.finance-net.com/ - ,49k -,Cached,
Quote.com: Homepage,"Lycos Finance- Get stock quotes, streaming LiveCharts, customizable Interactive charts, Raging Bull message boards, financial news & research, portfolio …",,, www.lycos.com/l/?6m - ,23k - ,Cached,
Journal of Finance: Other Finance Related Sites,"... Misc. Finance Site List ... Please, be sure to provide your full http address and the section heading(s) where you would like to be listed. Finance Journals. …",,, fisher.osu.edu/fin/journal/jofsites.htm - ,101k - ,Cached -,More pages from this site
American Finance Association ,academic organisation devoted to the study and promotion of knowledge about financial economics. ,Category:,Economics > College and University Organisations, www.afajof.org/ -,13k -,Cached -,More pages from this site
Careers in Finance,Careers in Finance. ... Welcome to Careers In Finance! This site is designed to help you find a rewarding and interesting job in the world of finance. …,,, www.careers-in-finance.com/ -,7k -,Cached -,More pages from this site
finance.com.ua ,http://finance.com.ua. ??????????? ?????????? ?????????? ?? ???????. …,,, finance.com.ua/ -,47k -,Cached -,More pages from this site
New York State Department of Taxation and Finance ,"official site. Includes tax forms, services, FAQs on taxes, and e-filing.  ",Category:,New York State > New York State Department of Taxation and Finance, www.tax.state.ny.us/ -,34k -,Cached -,More pages from this site
?????? ?? ?? ?????,???? ??? 39%? ??. ??? '??? ????  ??' ??? ? ? ??. ?? ????? 3% ?? ? ?. …,,, www.mofe.go.kr/ - ,42k - ,Cached,
California Department of Finance ,,Category:,U.S. States > California > California Department of Finance, www.dof.ca.gov/ -,18k -,Cached -,More pages from this site
globeinvestor.com,"includes news, quotes, and stock analysis for all major North American markets. ",Category:,Canada > Finance and Investment, www.globeinvestor.com/ -,68k -,Cached,
